Organisation Chain :,Tender ID :,Tender Ref No :,Tender Title :,S.No,Bank Name,Publish Date,Bid Opening Date,Document Download / Sale Start Date,Document Download / Sale End Date,Clarification Start Date,Clarification End Date,Bid Submission Start Date,Bid Submission End Date,Tender Fee in ₹,Fee Payable To,Fee Payable At,Tender Fee Exemption Allowed,Organisation Chain,Tender Reference Number,Tender ID,Withdrawal Allowed,Tender Type,Form of contract,Tender Category,No. of Covers,General Technical Evaluation Allowed,ItemWise Technical Evaluation Allowed,Payment Mode,Is Multi Currency Allowed For BOQ,Is Multi Currency Allowed For Fee,Allow Two Stage Bidding,Name,Address,S.No.1,Corrigendum Title,Corrigendum Type,View,Title,Work Description,Pre Qualification Details,Independent External Monitor/Remarks,Tender Value in ₹,Product Category,Sub category,Contract Type,Bid Validity(Days),Period Of Work(Days),Location,Pincode,Pre Bid Meeting Place,Pre Bid Meeting Address,Pre Bid Meeting Date,Bid Opening Place,Should Allow NDA Tender,Allow Preferential Bidder,EMD Amount in ₹,EMD through BG/ST or EMD Exemption Allowed,EMD Fee Type,EMD Percentage,EMD Payable To,EMD Payable At,Cover No,Cover,Document Type,Description
Principal Secretary-Department of Information Technology||Assam Electronics Development Corporation Ltd-DoIT||Store and Purchase - AMTRON - DoIT,2023_DoIT_31778_1,AEDC/Tech-City/RMU/2023-24/01,Selection of Electrical Contractor for Supply Installation Testing and Commissioning of 33KV RMU at Tech City Bongora Kamrup Assam,1.0,SBI Bank,25-Jul-2023 03:00 PM,11-Sep-2023 03:00 PM,25-Jul-2023 03:00 PM,08-Sep-2023 01:00 PM,25-Jul-2023 03:00 PM ,31-Jul-2023 12:00 PM ,02-Aug-2023 04:00 PM,08-Sep-2023 01:00 PM,"5,000",Nil,Nil,No,Principal Secretary-Department of Information Technology||Assam Electronics Development Corporation Ltd-DoIT||Store and Purchase - AMTRON - DoIT,AEDC/Tech-City/RMU/2023-24/01,2023_DoIT_31778_1,Yes,Open Tender,Item Rate,Works,2.0,No,No,Online,No,No,No,Managing Director AEDC Ltd,Assam Electronics Development Corporation Limited AMTRON Industrial Estate Bamunimaidan Guwahati 781021,1.0,Date Extension III,Date,,Selection of Electrical Contractor for Supply Installation Testing and Commissioning of 33KV RMU at Tech City Bongora Kamrup Assam,Selection of Electrical Contractor for Supply Installation Testing and Commissioning of 33KV RMU at Tech City Bongora Kamrup Assam,Refer RFP ,NA ,,Electrical Works,33KV RMU ,Tender,120.0,120.0,Bongora Kamrup,781015.0,AMTRON Bamunimaidan Guwahati 21 ,Assam Electronics Development Corporation Limited AMTRON Industrial Estate Bamunimaidan Guwahati 781021 ,01-Aug-2023 03:00 PM ,AEDC Ltd,No ,No,"50,000",Yes,fixed,,Nil,Nil,1.0,Fee/PreQual/Technical,.pdf,Signed copy of RFP
,,,,,,,,,,,,,,,,,,,,,,,,,,,,,,,,,,,,,,,,,,,,,,,,,,,,,,,,,,,,,,,,.pdf,EMD and Processing Fee Particulars
,,,,,,,,,,,,,,,,,,,,,,,,,,,,,,,,,,,,,,,,,,,,,,,,,,,,,,,,,,,,,,,,.pdf,Pre Qualification Documents
,,,,,,,,,,,,,,,,,,,,,,,,,,,,,,,,,,,,,,,,,,,,,,,,,,,,,,,,,,,,,,,,.pdf,Compliance and Technical Bid Documents
,,,,,,,,,,,,,,,,,,,,,,,,,,,,,,,,,,,,,,,,,,,,,,,,,,,,,,,,,,,,,,2.0,Finance,.xls,Price Bid
