Organisation Chain :,Tender ID :,Tender Ref No :,Tender Title :,S.No,Bank Name,Name,Address,Title,Work Description,Pre Qualification Details,Independent External Monitor/Remarks,Tender Value in ₹,Product Category,Sub category,Contract Type,Bid Validity(Days),Period Of Work(Days),Location,Pincode,Pre Bid Meeting Place,Pre Bid Meeting Address,Pre Bid Meeting Date,Bid Opening Place,Should Allow NDA Tender,Allow Preferential Bidder,Publish Date,Bid Opening Date,Document Download / Sale Start Date,Document Download / Sale End Date,Clarification Start Date,Clarification End Date,Bid Submission Start Date,Bid Submission End Date,Cover No,Cover,Document Type,Description,EMD Amount in ₹,EMD through BG/ST or EMD Exemption Allowed,EMD Fee Type,EMD Percentage,EMD Payable To,EMD Payable At,Organisation Chain,Tender Reference Number,Tender ID,Withdrawal Allowed,Tender Type,Form of contract,Tender Category,No. of Covers,General Technical Evaluation Allowed,ItemWise Technical Evaluation Allowed,Payment Mode,Is Multi Currency Allowed For BOQ,Is Multi Currency Allowed For Fee,Allow Two Stage Bidding,Tender Fee in ₹,Fee Payable To,Fee Payable At,Tender Fee Exemption Allowed,S.No.1,Corrigendum Title,Corrigendum Type,View
Department of Tourism||Assam Tourism Development Corporation Ltd. - DOT||HO-Guwahati-ATDCL - DOT,2023_DOT_32201_1,ATDC/2822/2017/Pt-II/BK01/2133 dt. 16.08.2023,Development Operation and Management Contract for running the newly constructed PanbariBasbari Cluster at Manas National Park,1.0,SBI Bank,"Managing Director, ATDC Ltd.","Office of the Managing Director, ATDC Ltd., Paltanbazar, Guwahati-8",Development Operation and Management Contract for running the newly constructed PanbariBasbari Cluster at Manas National Park,Development Operation and Management Contract for running the newly constructed Panbari Basbari Cluster at Manas National Park,Please refer Tender documents. ,NA ,"3,00,000",Hotel/ Catering,NA ,Tender,180.0,5475.0,"Manas National Park, Assam",781315.0,Guwahati ,"Office of the Managing Director, ATDC Ltd., Paltanbazar, Guwahati-8 ",28-Aug-2023 12:00 PM ,Guwahati,No ,No,24-Aug-2023 04:00 PM,12-Sep-2023 01:00 PM,24-Aug-2023 04:05 PM,11-Sep-2023 02:00 PM,NA ,NA ,28-Aug-2023 11:00 AM,11-Sep-2023 02:00 PM,1.0,Fee/PreQual/Technical,.pdf,Fresh Detail Notice Inviting Bid with seal and sign in each page downloaded from website,"72,000",Yes,fixed,,Nil,Nil,Department of Tourism||Assam Tourism Development Corporation Ltd. - DOT||HO-Guwahati-ATDCL - DOT,ATDC/2822/2017/Pt-II/BK01/2133 dt. 16.08.2023,2023_DOT_32201_1,Yes,Open Tender,Item Rate,Services,2.0,No,No,Online,No,No,No,"3,000",Nil,Nil,No,1.0,Extension Notice for Development Operation and Management Contract for running the newly constructed PanbariBasbari Cluster at Manas National Park,Date,
,,,,,,,,,,,,,,,,,,,,,,,,,,,,,,,,,,,,.pdf,Technical Bid with seal and sign in each page downloaded from website,,,,,,,,,,,,,,,,,,,,,,,,,2.0,Pre Bid Query Reply for Development Operation and Management Contract for running the newly constructed PanbariBasbari Cluster at Manas National Park,Other,
,,,,,,,,,,,,,,,,,,,,,,,,,,,,,,,,,,,,.pdf,Other Qualifications of the Bidder,,,,,,,,,,,,,,,,,,,,,,,,,3.0,Corrigendum for Development Operation and Management Contract for running the newly constructed PanbariBasbari Cluster at Manas National Park,Technical Bid,
,,,,,,,,,,,,,,,,,,,,,,,,,,,,,,,,,,2.0,Finance,.xls,BOQ,,,,,,,,,,,,,,,,,,,,,,,,,,,,
,,,,,,,,,,,,,,,,,,,,,,,,,,,,,,,,,,,,.pdf,Form of Bid,,,,,,,,,,,,,,,,,,,,,,,,,,,,
