Organisation Chain,Tender Reference Number,Tender ID,Withdrawal Allowed,Tender Type,Form of contract,Tender Category,No. of Covers,General Technical Evaluation Allowed,ItemWise Technical Evaluation Allowed,Payment Mode,Is Multi Currency Allowed For BOQ,Is Multi Currency Allowed For Fee,Allow Two Stage Bidding,Cover No,Cover,Document Type,Description,Name,Address,S.No,Bank Name,Title,Work Description,Pre Qualification Details,Independent External Monitor/Remarks,Tender Value in ₹,Product Category,Sub category,Contract Type,Bid Validity(Days),Period Of Work(Days),Location,Pincode,Pre Bid Meeting Place,Pre Bid Meeting Address,Pre Bid Meeting Date,Bid Opening Place,Should Allow NDA Tender,Allow Preferential Bidder,Publish Date,Bid Opening Date,Document Download / Sale Start Date,Document Download / Sale End Date,Clarification Start Date,Clarification End Date,Bid Submission Start Date,Bid Submission End Date,Financial Bid Opening Date,EMD Amount in ₹,EMD through BG/ST or EMD Exemption Allowed,EMD Fee Type,EMD Percentage,EMD Payable To,EMD Payable At,Tender Fee in ₹,Fee Payable To,Fee Payable At,Tender Fee Exemption Allowed,S.No.1,Corrigendum Title,Corrigendum Type,View,Tender Stage,S.No,Bid Number,Bidder Name,Submitted Date,Status,Remarks,Status Updated On,Type :,Summary :,Updated By :,Updated On :,Document :,Committee Chairperson/Co-ordinator Name :,Committee Chairperson/Co-ordinator Type :,Committee Members :,Updated By :.1,Updated On :.1,Financial Bid Opening Date:,Document :.1,Committee Chairperson/Co-ordinator Name :.1,Committee Chairperson/Co-ordinator Type :.1,Committee Members :.1,Updated By :.2,Updated on :,Document :.2,Type :.1,Summary :.1,Updated By :.3,Updated On :.2,Document :.3,BOQ Comparative Chart :,Organisation Chain :,Tender ID :,Tender Ref No :,Tender Title :,Tender Stage
Department of Tourism||Assam Tourism Development Corporation Ltd. - DOT||HO-Guwahati-ATDCL - DOT,ATDC/2822/2017/Pt-II/1918 dtd. 22.08.2022,2022_DOT_26750_1,Yes,Open Tender,Item Rate,Services,2.0,No,No,Online,No,No,No,1.0,Fee/PreQual/Technical,.pdf,Detail Notice Inviting Bid,"Managing Director, ATDC Ltd.","Office of the Managing Director, ATDC Ltd., Guwahati-8",1.0,SBI Bank,Operation and Management Contract for Wayside Amenity Centre at Silapathar,Operation and Management Contract for Wayside Amenity Centre at Silapathar,Please refer Tender documents. ,NA ,"20,000",Hotel/ Catering,NA ,Tender,180.0,1825.0,Silapathar,787059.0,Guwahati ,"Office of the Managing Director, ATDC Ltd., Guwahati-8 ",30-Aug-2022 12:00 PM ,Guwahati,No ,No,25-Aug-2022 04:30 PM,29-Sep-2022 01:00 PM,25-Aug-2022 04:45 PM,28-Sep-2022 02:00 PM,NA ,NA ,25-Aug-2022 04:45 PM,28-Sep-2022 02:00 PM,10-Apr-2023 12:00 PM,"4,800",Yes,fixed,,Nil,Nil,"3,000",Nil,Nil,Yes,1.0,Extension Notice for Operation and Management Contract for Wayside Amenity Centre at Silapathar,Date,,Financial Evaluation,1.0,158922.0,D D TRADERS,28-Sep-2022 12:49 PM,Accepted-Finance,Quoted lowest rate,25-Apr-2023 11:36 AM,Technical,Statement of Technical Bid,Kishore Dutta,04-Apr-2023 03:31 PM,technical_41274.pdf,Prabhash Ch Sarma,Internal,Rajat Lal Das Tina Mitra,Kishore Dutta,04-Apr-2023 03:35 PM,10-Apr-2023 12:00 PM,techsummary_41274.pdf (173.91 KB),Bhaskar Jyoti Baruah,Internal,Kishore Dutta Kushal Sarma,Kishore Dutta,25-Apr-2023 11:36 AM,finsummary_41274.pdf (167.40 KB),Finance,Statement of Financial Bid,Kishore Dutta,25-Apr-2023 11:32 AM,finance_41274.pdf,BOQ Comparative Chart,Department of Tourism||Assam Tourism Development Corporation Ltd. - DOT||HO-Guwahati-ATDCL - DOT,2022_DOT_26750_1,ATDC/2822/2017/Pt-II/1918 dtd. 22.08.2022,Operation and Management Contract for Wayside Amenity Centre at Silapathar,Financial Evaluation
,,,,,,,,,,,,,,,,.pdf,Technical Bid with seal and sign in each page downloaded from website,,,,,,,,,,,,,,,,,,,,,,,,,,,,,,,,,,,,,,,,,,,,,,Financial Evaluation,2.0,157450.0,M/s Bijoy Sankar Borah,12-Sep-2022 02:24 PM,Not Admitted-Fee/PreQual/Technical,Not Complied with technical specification,04-Apr-2023 03:31 PM,,,,,,,,,,,,,,,,,,,,,,,,,,,,,Financial Evaluation
,,,,,,,,,,,,,,,,.pdf,Other Qualification,,,,,,,,,,,,,,,,,,,,,,,,,,,,,,,,,,,,,,,,,,,,,,Financial Evaluation,3.0,158021.0,NIBEDITA ENGINEERING,28-Sep-2022 01:26 PM,Accepted-Finance,Quoted highest rate,25-Apr-2023 11:36 AM,,,,,,,,,,,,,,,,,,,,,,,,,,,,,Financial Evaluation
,,,,,,,,,,,,,,2.0,Finance,.xls,BOQ,,,,,,,,,,,,,,,,,,,,,,,,,,,,,,,,,,,,,,,,,,,,,,Financial Evaluation,4.0,158940.0,P.G.ENTERPRISES,28-Sep-2022 12:17 PM,Not Admitted-Fee/PreQual/Technical,Not Complied with technical specification,04-Apr-2023 03:31 PM,,,,,,,,,,,,,,,,,,,,,,,,,,,,,Financial Evaluation
,,,,,,,,,,,,,,,,.pdf,Form of Bid,,,,,,,,,,,,,,,,,,,,,,,,,,,,,,,,,,,,,,,,,,,,,,Financial Evaluation,,,,,,,,,,,,,,,,,,,,,,,,,,,,,,,,,,,,Financial Evaluation
