Cover No,Cover,Document Type,Description,Organisation Chain,Tender Reference Number,Tender ID,Withdrawal Allowed,Tender Type,Form of contract,Tender Category,No. of Covers,General Technical Evaluation Allowed,ItemWise Technical Evaluation Allowed,Payment Mode,Is Multi Currency Allowed For BOQ,Is Multi Currency Allowed For Fee,Allow Two Stage Bidding,Name,Address,S.No,Bank Name,Publish Date,Bid Opening Date,Document Download / Sale Start Date,Document Download / Sale End Date,Clarification Start Date,Clarification End Date,Bid Submission Start Date,Bid Submission End Date,Financial Bid Opening Date,EMD Amount in ₹,EMD through BG/ST or EMD Exemption Allowed,EMD Fee Type,EMD Percentage,EMD Payable To,EMD Payable At,Title,Work Description,Pre Qualification Details,Independent External Monitor/Remarks,Tender Value in ₹,Product Category,Sub category,Contract Type,Bid Validity(Days),Period Of Work(Days),Location,Pincode,Pre Bid Meeting Place,Pre Bid Meeting Address,Pre Bid Meeting Date,Bid Opening Place,Should Allow NDA Tender,Allow Preferential Bidder,Tender Fee in ₹,Fee Payable To,Fee Payable At,Tender Fee Exemption Allowed,S.No.1,Corrigendum Title,Corrigendum Type,View,Tender Stage,Organisation Chain :,Tender ID :,Tender Ref No :,Tender Title :,S.No,Bid Number,Bidder Name,Submitted Date,Status,Remarks,Status Updated On,Type :,Summary :,Updated By :,Updated On :,Document :,Committee Chairperson/Co-ordinator Name :,Committee Chairperson/Co-ordinator Type :,Committee Members :,Updated By :.1,Updated On :.1,Financial Bid Opening Date:,Document :.1,S.No.,Corrigendum Title,Corrigendum Type,Corrigendum Description,Corrigendum Reason,Published Date,Document Name,Doc Size(in KB),Tender Stage
1.0,Fee/PreQual/Technical,.pdf,SBD,National Health Mission||State Programme Management Unit - NHM,NHM-32042/5/2019-Cons-NHM/115,2022_NHM_28028_1,Yes,Open Tender,Item Rate,Works,2.0,No,No,Online,No,No,No,"MD, NHM, Assam","O/O MD, NHM, Assam, Guwahati-05",1.0,SBI Bank,05-Dec-2022 03:30 PM,13-Dec-2022 03:30 PM,05-Dec-2022 03:30 PM,12-Dec-2022 02:00 PM,NA ,NA ,05-Dec-2022 03:30 PM,12-Dec-2022 02:00 PM,09-Jan-2023 09:00 AM,"30,833",Yes,percentage,2.0%,Nil,Nil,Installation of Deep Tube Well 2nos including Electrical works at Bijni SDCH in Chirang District,Installation of Deep Tube Well 2nos including Electrical works at Bijni SDCH in Chirang District,Please refer Tender documents. ,NA ,"15,41,627",Civil Works - Building,NA ,Tender,180.0,15.0,Bijni,783390.0,NA ,NA ,NA ,"O/O MD, NHM, Assam",No ,No,500.0,Nil,Nil,No,1.0,CANCELLATION NOTICE,Cancellation of Tender,,Cancelled,National Health Mission||State Programme Management Unit - NHM,2022_NHM_28028_1,NHM-32042/5/2019-Cons-NHM/115,Installation of Deep Tube Well 2nos including Electrical works at Bijni SDCH in Chirang District,1,165532,Build worth Trade Engineers,08-Dec-2022 08:35 PM,Accepted-Technical,ADMITTED,07-Jan-2023 06:30 PM,Technical,TBER,Dipjyoti Deka,07-Jan-2023 06:28 PM,technical_44448.pdf,ED,Internal,"AMD,CC(CW),C(CW),DF,FA,SE,SE(E)",Dipjyoti Deka,07-Jan-2023 06:30 PM,09-Jan-2023 09:00 AM,techsummary_44448.pdf (40.91 KB),1.0,CANCELLATION NOTICE,Cancellation of Tender,CANCELLATION NOTICE,L1 quoted/revised rate is high,05-Apr-2023 04:28 PM,CancellationDeeptunewellBijni.pdf ,419.57,Cancelled
,,.pdf,EMD AND TENDER FEE,,,,,,,,,,,,,,,,,,,,,,,,,,,,,,,,,,,,,,,,,,,,,,,,,,,,,,,,,,,,Cancelled,,,,,2,166115,MANAJIT BASUMATARY,10-Dec-2022 07:50 PM,Not Admitted-Fee/PreQual/Technical,Not Complied with technical specification,07-Jan-2023 06:28 PM,,,,,,,,,,,,,,,,,,,,,Cancelled
,,.pdf,TECHNICAL QUALIFICATION,,,,,,,,,,,,,,,,,,,,,,,,,,,,,,,,,,,,,,,,,,,,,,,,,,,,,,,,,,,,Cancelled,,,,,3,165529,M/S I.S. Trading Co.,08-Dec-2022 07:04 PM,Accepted-Technical,ADMITTED,07-Jan-2023 06:30 PM,,,,,,,,,,,,,,,,,,,,,Cancelled
2.0,Finance,.xls,BOQ,,,,,,,,,,,,,,,,,,,,,,,,,,,,,,,,,,,,,,,,,,,,,,,,,,,,,,,,,,,,Cancelled,,,,,4,166120,M/s Mazumdar Construction,10-Dec-2022 10:19 PM,Not Admitted-Fee/PreQual/Technical,Not Complied with technical specification,07-Jan-2023 06:28 PM,,,,,,,,,,,,,,,,,,,,,Cancelled
,,.pdf,FOB,,,,,,,,,,,,,,,,,,,,,,,,,,,,,,,,,,,,,,,,,,,,,,,,,,,,,,,,,,,,Cancelled,,,,,5,165516,M/S N.E. Infra,08-Dec-2022 07:58 PM,Accepted-Technical,ADMITTED,07-Jan-2023 06:30 PM,,,,,,,,,,,,,,,,,,,,,Cancelled
