Publish Date,Bid Opening Date,Document Download / Sale Start Date,Document Download / Sale End Date,Clarification Start Date,Clarification End Date,Bid Submission Start Date,Bid Submission End Date,S.No,Bank Name,EMD Amount in ₹,EMD through BG/ST or EMD Exemption Allowed,EMD Fee Type,EMD Percentage,EMD Payable To,EMD Payable At,Organisation Chain,Tender Reference Number,Tender ID,Withdrawal Allowed,Tender Type,Form of contract,Tender Category,No. of Covers,General Technical Evaluation Allowed,ItemWise Technical Evaluation Allowed,Payment Mode,Is Multi Currency Allowed For BOQ,Is Multi Currency Allowed For Fee,Allow Two Stage Bidding,Name,Address,Title,Work Description,Pre Qualification Details,Independent External Monitor/Remarks,Tender Value in ₹,Product Category,Sub category,Contract Type,Bid Validity(Days),Period Of Work(Days),Location,Pincode,Pre Bid Meeting Place,Pre Bid Meeting Address,Pre Bid Meeting Date,Bid Opening Place,Should Allow NDA Tender,Allow Preferential Bidder,Tender Fee in ₹,Fee Payable To,Fee Payable At,Tender Fee Exemption Allowed,S.No.1,Corrigendum Title,Corrigendum Type,View,Cover No,Cover,Document Type,Description,Tender Stage,S.No,Bid Number,Bidder Name,Submitted Date,Status,Remarks,Status Updated On,S.No.,Corrigendum Title,Corrigendum Type,Corrigendum Description,Corrigendum Reason,Published Date,Document Name,Doc Size(in KB),Type :,Summary :,Updated By :,Updated On :,Document :,Organisation Chain :,Tender ID :,Tender Ref No :,Tender Title :,Tender Stage
03-Feb-2022 01:00 PM,17-Mar-2022 04:00 PM,03-Feb-2022 01:10 PM,17-Mar-2022 02:00 PM,NA ,NA ,12-Feb-2022 10:00 AM,17-Mar-2022 02:00 PM,1.0,SBI Bank,"2,00,000",Yes,fixed,,Nil,Nil,Health and Family Welfare Department||Directorate of Medical Education-HFWD,DME/Plastic Surgery/11/2022/Pt-I/1415,2022_HFWD_24183_1,Yes,Open Tender,Item Rate,Goods,2.0,No,No,Online,No,No,No,Director of Medical Education Assam,"Office of the Directorate of Medical Education Assam, Sixmile, Khanapara Guwahati",Supply and installation of equipment related to Plastic Surgery Department,Supply and installation of equipment related to Plastic Surgery Department for all Medical College Hospitals of Assam,Please refer tender documents ,NA ,,Medical Equipments/Waste,NA ,Rate Contract,180.0,45.0,Medical College Hospitals of Assam,781022.0,"DME Assam, Sixmile, Khanapara Guwahati ","Office of the Directorate of Medical Education Assam, Sixmile, Khanapara Guwahati ",11-Feb-2022 11:00 AM ,"DME Assam, Sixmile, Khanapara Guwahati",No ,No,"5,000",Nil,Nil,Yes,1.0,Cancellation of tender,Cancellation of Tender,,1.0,Fee/PreQual/Technical,.pdf,Prequalification,Cancelled,1,132906,MEDISURGE INC,06-Mar-2022 01:42 PM,Admitted-Fee/PreQual/Technical,,25-Mar-2022 01:11 PM,1.0,Cancellation of tender,Cancellation of Tender,Cancellation of tender in respect of tender published vide no. DME/Plastic Surgery/11/2022/Pt-I/1415,Due to admistrative reasons/issues,12-Apr-2023 12:57 PM,tendercancellation-various.pdf ,278.07,Technical,Accepted for further technical evaluation,Bhupen Chandra Sarma,25-Mar-2022 01:11 PM,technical_37128.pdf,Health and Family Welfare Department||Directorate of Medical Education-HFWD,2022_HFWD_24183_1,DME/Plastic Surgery/11/2022/Pt-I/1415,Supply and installation of equipment related to Plastic Surgery Department,Cancelled
,,,,,,,,,,,,,,,,,,,,,,,,,,,,,,,,,,,,,,,,,,,,,,,,,,,,,,2.0,Extension notice,Date,,,,.pdf,Technical Bid,Cancelled,2,135569,M/s Marak Supply and Agencies,07-Mar-2022 01:08 PM,Admitted-Fee/PreQual/Technical,,25-Mar-2022 01:11 PM,,,,,,,,,,,,,,,,,,Cancelled
,,,,,,,,,,,,,,,,,,,,,,,,,,,,,,,,,,,,,,,,,,,,,,,,,,,,,,3.0,Minutes of Special Prebid Meeting,Other,,2.0,Finance,.xls,BOQ,Cancelled,3,135337,NJD TRADERS,07-Mar-2022 12:01 PM,Admitted-Fee/PreQual/Technical,,25-Mar-2022 01:11 PM,,,,,,,,,,,,,,,,,,Cancelled
,,,,,,,,,,,,,,,,,,,,,,,,,,,,,,,,,,,,,,,,,,,,,,,,,,,,,,,,,,,,.pdf,SupplementaryBOQ,Cancelled,4,134117,Timpac Healthcare Pvt. Ltd.,07-Mar-2022 01:14 PM,Admitted-Fee/PreQual/Technical,,25-Mar-2022 01:11 PM,,,,,,,,,,,,,,,,,,Cancelled
,,,,,,,,,,,,,,,,,,,,,,,,,,,,,,,,,,,,,,,,,,,,,,,,,,,,,,,,,,,,,,Cancelled,5,142412,United Traders,17-Mar-2022 12:04 PM,Admitted-Fee/PreQual/Technical,,25-Mar-2022 01:11 PM,,,,,,,,,,,,,,,,,,Cancelled
,,,,,,,,,,,,,,,,,,,,,,,,,,,,,,,,,,,,,,,,,,,,,,,,,,,,,,,,,,,,,,Cancelled,6,133688,Vikas Medical Devices,05-Mar-2022 11:54 AM,Admitted-Fee/PreQual/Technical,,25-Mar-2022 01:11 PM,,,,,,,,,,,,,,,,,,Cancelled
